### ISSUE TITLE
The client will automatically shutdown when using tls/ssl

### ISSUE THREAD

**Issue by stfujnkk** [stfujnkk/pzrp#5]
![image](https://github.com/stfujnkk/pzrp/assets/52458236/c7e3cc0e-ea5d-4598-ad14-56a3c6addbd4)
![image](https://github.com/stfujnkk/pzrp/assets/52458236/029b700d-2204-436e-b3a4-9db3fc3526af)

**Comment by stfujnkk** [comment]
临时解决方案：不用证书加密

**Comment by stfujnkk** [comment]
![image](https://github.com/stfujnkk/pzrp/assets/52458236/ba5127b5-f2b4-4e6d-a952-21d2ce01e24d)

**Comment by stfujnkk** [comment]
```
tcpdump udp port 17015
tcpdump: verbose output suppressed, use -v or -vv for full protocol decode
listening on eth0, link-type EN10MB (Ethernet), capture size 262144 bytes

12:35:43.395334 IP 195.xxx.xxx.xxx.16439 > 10.0.4.3.17015: UDP, length 46
12:35:43.408841 IP 195.xxx.xxx.xxx.16439 > 10.0.4.3.17015: UDP, length 46
12:35:43.421838 IP 10.0.4.3.17015 > 195.xxx.xxx.xxx.16439: UDP, length 64
12:35:43.437824 IP 195.xxx.xxx.xxx.16439 > 10.0.4.3.17015: UDP, length 46
12:35:43.470842 IP 195.xxx.xxx.xxx.16439 > 10.0.4.3.17015: UDP, length 46
12:35:43.503843 IP 195.xxx.xxx.xxx.16439 > 10.0.4.3.17015: UDP, length 46
12:35:43.528841 IP 10.0.4.3.17015 > 195.xxx.xxx.xxx.16439: UDP, length 63
12:35:43.537333 IP 195.xxx.xxx.xxx.16439 > 10.0.4.3.17015: UDP, length 46
12:35:43.570837 IP 195.xxx.xxx.xxx.16439 > 10.0.4.3.17015: UDP, length 46
12:35:43.574827 IP 10.0.4.3.17015 > 195.xxx.xxx.xxx.16439: UDP, length 59
12:35:43.590882 IP 10.0.4.3.17015 > 195.xxx.xxx.xxx.16439: UDP, length 83
12:35:43.604356 IP 195.xxx.xxx.xxx.16439 > 10.0.4.3.17015: UDP, length 46
12:35:43.637331 IP 195.xxx.xxx.xxx.16439 > 10.0.4.3.17015: UDP, length 46
12:35:43.652368 IP 10.0.4.3.17015 > 195.xxx.xxx.xxx.16439: UDP, length 66
12:35:43.670829 IP 195.xxx.xxx.xxx.16439 > 10.0.4.3.17015: UDP, length 46
12:35:43.704342 IP 195.xxx.xxx.xxx.16439 > 10.0.4.3.17015: UDP, length 46
12:35:43.714907 IP 10.0.4.3.17015 > 195.xxx.xxx.xxx.16439: UDP, length 74
12:35:43.742850 IP 195.xxx.xxx.xxx.16439 > 10.0.4.3.17015: UDP, length 46
12:35:43.770835 IP 195.xxx.xxx.xxx.16439 > 10.0.4.3.17015: UDP, length 46
12:35:43.804351 IP 195.xxx.xxx.xxx.16439 > 10.0.4.3.17015: UDP, length 46
12:35:43.837333 IP 195.xxx.xxx.xxx.16439 > 10.0.4.3.17015: UDP, length 46
12:35:43.870836 IP 195.xxx.xxx.xxx.16439 > 10.0.4.3.17015: UDP, length 46
12:35:43.904329 IP 195.xxx.xxx.xxx.16439 > 10.0.4.3.17015: UDP, length 46
12:35:43.964838 IP 195.xxx.xxx.xxx.16439 > 10.0.4.3.17015: UDP, length 46
12:35:43.980331 IP 195.xxx.xxx.xxx.16439 > 10.0.4.3.17015: UDP, length 46
12:35:44.004339 IP 195.xxx.xxx.xxx.16439 > 10.0.4.3.17015: UDP, length 46
12:35:44.037348 IP 195.xxx.xxx.xxx.16439 > 10.0.4.3.17015: UDP, length 46
12:35:44.071341 IP 195.xxx.xxx.xxx.16439 > 10.0.4.3.17015: UDP, length 46
12:35:44.107353 IP 195.xxx.xxx.xxx.16439 > 10.0.4.3.17015: UDP, length 46
12:35:44.137337 IP 195.xxx.xxx.xxx.16439 > 10.0.4.3.17015: UDP, length 46
12:35:44.170834 IP 195.xxx.xxx.xxx.16439 > 10.0.4.3.17015: UDP, length 46
12:35:44.204344 IP 195.xxx.xxx.xxx.16439 > 10.0.4.3.17015: UDP, length 46
12:35:48.561937 IP 195.xxx.xxx.xxx.16439 > 10.0.4.3.17015: UDP, length 46
12:35:48.595463 IP 195.xxx.xxx.xxx.16439 > 10.0.4.3.17015: UDP, length 46
12:35:48.605976 IP 10.0.4.3.17015 > 195.xxx.xxx.xxx.16439: UDP, length 79
12:35:48.628966 IP 195.xxx.xxx.xxx.16439 > 10.0.4.3.17015: UDP, length 46
12:35:48.651998 IP 10.0.4.3.17015 > 195.xxx.xxx.xxx.16439: UDP, length 76
12:35:48.661947 IP 195.xxx.xxx.xxx.16439 > 10.0.4.3.17015: UDP, length 46
12:35:48.695465 IP 195.xxx.xxx.xxx.16439 > 10.0.4.3.17015: UDP, length 46
12:35:48.713983 IP 10.0.4.3.17015 > 195.xxx.xxx.xxx.16439: UDP, length 80
12:35:48.731964 IP 195.xxx.xxx.xxx.16439 > 10.0.4.3.17015: UDP, length 46
12:35:48.765456 IP 195.xxx.xxx.xxx.16439 > 10.0.4.3.17015: UDP, length 46
12:35:48.775036 IP 10.0.4.3.17015 > 195.xxx.xxx.xxx.16439: UDP, length 79
12:35:48.798473 IP 195.xxx.xxx.xxx.16439 > 10.0.4.3.17015: UDP, length 46
12:35:48.821029 IP 10.0.4.3.17015 > 195.xxx.xxx.xxx.16439: UDP, length 79
12:35:48.832429 IP 195.xxx.xxx.xxx.16439 > 10.0.4.3.17015: UDP, length 46
12:35:48.865467 IP 195.xxx.xxx.xxx.16439 > 10.0.4.3.17015: UDP, length 46
12:35:48.867497 IP 10.0.4.3.17015 > 195.xxx.xxx.xxx.16439: UDP, length 98
Bad packet length 3858040453.
ssh_dispatch_run_fatal: Connection to 124.xxx.xxx.xxx port 22: Connection corrupted
```
